{
  "id": "wild",
  "title": "Wild",
  "face": {
    "kind": "text",
    "color": "white",
    "label": "jolly",
    "art_version": 1
  },
  "tags": [
    "wild",
    "action",
    "uni:wild"
  ],
  "behavior": {
    "on_play": {
      "nodes": [
        {
          "id": "n1",
          "op": "prompt",
          "args": {
            "kind": "choose_color",
            "target": "@self"
          },
          "next": "n2"
        },
        {
          "id": "n2",
          "op": "set_active_type",
          "args": {
            "from_prompt": "n1"
          }
        }
      ]
    }
  }
}
