{
  "id": "yellow_skip",
  "title": "Yellow Skip",
  "face": {
    "kind": "text",
    "color": "yellow",
    "label": "skip",
    "art_version": 1
  },
  "tags": [
    "colored",
    "action",
    "yellow",
    "skip",
    "uni:skip"
  ],
  "behavior": {
    "on_play": {
      "nodes": [
        {
          "id": "n1",
          "op": "skip_turn",
          "args": {
            "target": "@next_player"
          }
        }
      ]
    }
  }
}
